{
  "@context": "https://openevidence.dev/signing/v1",
  "version": "1.0",
  "id": "env_vec_unknown_0007",
  "issuer": {
    "id": "https://app.screenata.example",
    "name": "Screenata (test)",
    "keyDiscovery": "https://app.screenata.example/.well-known/oes-signing"
  },
  "subject": {
    "type": "compliance-evidence",
    "contentHash": {
      "algorithm": "SHA-256",
      "value": "f3d8ff9363d641ac34699ac56636c736dcb97954980a66e53656219497feb56a"
    },
    "metadata": {
      "title": "Unknown key",
      "collectedAt": "2026-04-20T10:30:00.000Z"
    }
  },
  "proof": {
    "type": "RsaSignature2024",
    "created": "2026-04-20T10:30:00.000Z",
    "algorithm": "RSA-SHA256",
    "publicKeyFingerprint": "abffd185f6a6d545",
    "signatureValue": "Nqv2efLS0qtigcHRuiTjD920W3Z4wzL8fGbNanKxkf4fnfbffti2FqZzzHb6dLX2J2nG8eD/NLUEmgYh0L3ouUMUyvWHA9ktCXoHsdoYbZqPg7yStsyiQxvJIL6w2kioHvOrB3da1MaZ3LToHIqQTwnlrUPtn73lW33QQSEV2ZLVV3ZvR1Bw8LR/WPAgvUwnCfE3KRiLvXEq7tM/8+6L/9XZhD/UzJ30AjBOnvl3+GsQlz4MeikhToBkNOJw/kJhZAXwOtB03l5xVGsGXTw6NVSUYzjgw6BbVEdcYxIbR8MoK+6BZGETBT8/BKGJ8gubtN9XxvQxKlumcQfg/ksYyA==",
    "canonicalization": "sorted-keys-2space",
    "signedFields": "subject"
  }
}
